title,citation,date,form,part_of,part_of_links,condition,copyright,imageLink,uniqueID,parent_uniqueID,parent_date,parent_desc,parent_title,parent_scope,physical_desc,subject,physical_desc_notes,numbers,other,scope,date_notes,title_notes,notes,author,author_notes,finding_aids,scale,geolocatable,datable,date_start,date_end,user_notes,latLng
"Rolling Stock emergency truck #122, (Federal), (Garage Department)","Fonds 16, Series 71, Item 11355",1936,"Photographs
Photographs - details",Series 71; Central photography series of the Toronto Transit Commission,,"OPEN - No restrictions on these government records.Researchers may not have access to original prints or negatives, but may use the reference photocopies available in the Research hall.",Copyright is in the public domain and permission for use is not required...more,https://gencat4.eloquent-systems.com:443/webcat/systems/toronto.arch/resource/ser71/s0071_it11355.jpg,58220,25217,,,,,"1 photoprint : b&w; ; 13 x 18 cm
1 photonegative : glass, b&w; ; 13 x 18 cm",trucks (browse  records),,,"A reference photocopy of this image is available on the photograph collection shelves of the Research Hall. See TTC Collection, Series 71, Wickson Worksheets.",,,,,Alfred Pearson,"City of Toronto Archives, Series 71, Item 11355",,,Not Locatable,yes,1936,,,
News board at Toronto Summit Square,"Fonds 200, Series 1465, File 743, Item 29",1988,Photographs,File 743; Toronto Summit Square and Bay Street,,OPEN - No restrictions on these government records.,Copyright was transferred to the City of Toronto by the copyright owner. ...more,https://gencat4.eloquent-systems.com:443/webcat/systems/toronto.arch/resource/ser1465/s1465_fl0743_it0029.jpg,600706,325774,1988-1991," 
30 transparencies : colour ; 35mm",Toronto Summit Square and Bay Street,"File consists of images of Toronto Summit Square west of Roy Thomson Hall, as well as other aspects of the 1988 G7 summit. File also includes images of Bay Street looking north to City Hall.",,,,,,,,,,,,,,Locatable,yes,1988,,,"{""latLng"":""43.64642651222848,-79.38731197990114""}"
Gould looking east from Yonge at night,"Fonds 200, Series 1465, File 19, Item 54",[198-],Photographs,File 19; Capital works - Yonge Street and Gould Street,,OPEN - No restrictions on these government records.,Copyright is held by the City of Toronto....more,https://gencat4.eloquent-systems.com:443/webcat/systems/toronto.arch/resource/ser1465/s1465_fl0019_id0054.jpg,439574,306854,[198-],69 transparencies : col. ; 35mm,Capital works - Yonge Street and Gould Street,This file consists of 67 photographs and 2 architectual drawings depicting the intersection of Yonge Street and Gould Street. The chess tables and street vendors are visible in some images Reconstruction of the road and sidewalks is also shown.,,NIGHT (browse  records),,,,,,,,,,,,Locatable,yes,1980,1989,,"{""latLng"":""43.6574008,-79.3813604""}"
Six Points Interchange area,"Fonds 220, Series 65, File 150, Item 25",,,File 150; Six Points Interchange area,,"Vinegar syndrome has affected the original film media. It has been frozen for preservation reasons, and therefore may not be requested for viewing in the Research Hall. ",Copyright was transferred to the City of Toronto by the copyright owner. ...more,https://gencat4.eloquent-systems.com:443/webcat/systems/toronto.arch/resource/fo0220/ser0065/s0065_fl0150_it0025.jpg,435673,340493,"June 16, 1960",72 photographs : b&w; negatives,Six Points Interchange area,"File consists of photographs of the area around the Six Points Interchange, the area where Kipling Avenue, Dundas Street West, and Bloor Street West meet, before it was built.",,,,,,,,,,,,,,Locatable,yes,1960,,,"{""latLng"":""43.64151349999999,-79.53519589999996""}"
University looking south to Dundas,"Fonds 200, Series 1465, File 607, Item 38",1983,Photographs,File 607; Streets - University,,OPEN - No restrictions on these government records.,Copyright is held by the City of Toronto....more,https://gencat4.eloquent-systems.com:443/webcat/systems/toronto.arch/resource/ser1465/s1465_fl0607_it0038.jpg,555052,324345,1983,40 transparencies : colour ; 35mm,Streets - University,"File consists of images of University Avenue between College and Front, as well as a few of Queen's Park south of Bloor.",,,,,,,,,,,,,,Locatable,yes,1983,,"that's a picture looking South towards Queens, picture is mislabeled, if you need any convincing, look at where the hilton is in real life (unless it has moved)","{""latLng"":""43.65168751171457,-79.38707358227839""}"
"University Armory, officers training","Fonds 1266, Item 69229","September 25, 1940",Photographs,Fonds 1266; Globe and Mail fonds,,OPEN - No restrictions on these non-government records.,"Copyright is in the public domain and permission for use is not required...moreThe following citation must be used when exhibiting or publishing this image: City of Toronto Archives, Globe and Mail fonds, Fonds 1266, Item 69229.",https://gencat4.eloquent-systems.com:443/webcat/systems/toronto.arch/resource/fo1266/f1266_it69229.jpg,570591,46341,,,,,1 photonegative : b&w; ; nitrate ; 10 x 13 cm,,Original nitrate negative was digitized in 2012. Researches are not able to access the original negative. Please refer to the digital file.,Previously cited: City of Toronto Archives SC 266-69229.,,,,,,,,,,Locatable,yes,1940,,"Figured out where this was based on http://torontoplaques.com/Pages/University_Avenue_Armouries.html

Demolished in 1963.","{""latLng"":""43.6530606,-79.38772719999997""}"
North-east corner of Stadium Road and Queens Quay West,"Fonds 200, Series 1465, File 54, Item 97",[between 1980 and 1998],Photographs,"File 54; District, Harbourfront",,OPEN - No restrictions on these government records.,Copyright is held by the City of Toronto....more,https://gencat4.eloquent-systems.com:443/webcat/systems/toronto.arch/resource/ser1465/s1465_fl0054_id0097.jpg,440938,306889,[between 1980 and 1998],113 transparencies : col. ; 35mm,"District, Harbourfront",File consists of images of the central waterfront and the Port Lands (Port Industrial District). ,,HOUSING (browse  records),,,,,,,,,,,,Locatable,yes,1980,1998,,"{""latLng"":""43.6344967,-79.4005932""}"
Spadina Avenue looking north?,"Fonds 200, Series 1465, File 119, Item 83",[between 1890? and 1910?],Photographs,File 119; Miscellaneous,,OPEN - No restrictions on these government records.,Copyright is held by the City of Toronto....more,https://gencat4.eloquent-systems.com:443/webcat/systems/toronto.arch/resource/ser1465/s1465_fl0119_id0083.jpg,443265,308290,[18--]-1998,428 transparencies : col. ; b&w; ; 35mm ,Miscellaneous : volume 3,File consists of images depicting Toronto and other cities.,,,,,,,Image is a copy made between 1980 and 1989.,,,,,,,Not Locatable,yes,1890,1910,,"{""latLng"":""43.6518338,-79.3974809""}"
Waterfront proposals,"Fonds 200, Series 1465, File 263, Item 5",[between 1980 and 1998],Photographs,File 263; Waterfront proposals,,OPEN - No restrictions on these government records.,Copyright is held by the City of Toronto....more,https://gencat4.eloquent-systems.com:443/webcat/systems/toronto.arch/resource/ser1465/s1465_fl0263_it0005.jpg,448716,307098,[between 1977 and 1998],13 transparencies : col. ; 35mm,Waterfront proposals,"File consists of maps, diagrams, sketches, text, and other visuals to do with planning redevelopment on the waterfront.",,,,,,,,,,,,,,Not Locatable,yes,1990,1998,,
"Irvine ""Ace"" Bailey of the Toronto Maple Leafs Hockey Club in his office with unidentified man","Fonds 1257, Series 1057, Item 2376",1969,Photographs,Series 1057; Alexandra Studio commissioned photographs,,"Vinegar syndrome has affected the original film media. It has been frozen for preservation reasons, and therefore may not be requested for viewing in the Research Hall. ",Copyright was transferred to the City of Toronto by the copyright owner. ...more,https://gencat4.eloquent-systems.com:443/webcat/systems/toronto.arch/resource/fo1257/ser1057/f1257_s1057_it2376.jpg,213168,210141,,,,,1 photonegative : b&w; ; 11 x 13 cm,OFFICES (browse  records) hockey (browse  records) ATHLETES (browse  records) COACHES (PERSONS) (browse  records),,,,,,,,,,,,Maybe,yes,1969,1969,,
504 Adelaide Street West,"Fonds 200, Series 372, Subseries 33, Item 362","May 5, 1938",,Subseries 33; Housing photographs,,OPEN - No restrictions on these government records.,Copyright is in the public domain and permission for use is not required...more,https://gencat4.eloquent-systems.com:443/webcat/systems/toronto.arch/resource//ser372/ss0033/s0372_ss0033_it0362.jpg,247371,83978,1936-1951,986 photographs : b&w; ; 13 x 18 cm and smaller,Housing photographs,Subseries consists of photographs of houses located across the former City of Toronto.,1 photonegative ; b&w; ; 13 x 18 cm. - 1 photoprint : b&w; ; 13 x 18 cm,,,,,,,,,,,,,Locatable,yes,1938,1938,,"{""latLng"":""43.6458109,-79.40077180000003""}"
"Riverdale Zoo, Golden Eagle","Fonds 1266, Item 22971","January 28, 1931",Photographs,Fonds 1266; Globe and Mail fonds,,"OPEN - No restrictions on these non-government records.To preserve the original negatives, researchers should consult the microfiche reference copies, available in the Research Hall.","Copyright is in the public domain and permission for use is not required...moreThe following citation must be used when exhibiting or publishing this image: City of Toronto Archives, Globe and Mail fonds, Fonds 1266, Item 22971.",https://gencat4.eloquent-systems.com:443/webcat/systems/toronto.arch/resource/fo1266/f1266_it22971.jpg,307766,46341,,,,,"1 photonegative : b&w;, safety film ; 10 x 13 cm",ANIMALS (browse  records),"Negative was reformatted from nitrate film to safety film, between 1987 and 1990.",Previously cited: City of Toronto Archives SC 266-22971,"This photograph is available on microfiche, in the Research Hall at the City of Toronto Archives.",,,,,,,,,Locatable,yes,1931,1931,,"{""latLng"":""43.6671213,-79.36112509999998""}"
"Burning of S.S. John Hanlan, at Sunnyside, (Ferry Department)","Fonds 16, Series 71, Item 7021","July 15, 1929",,Series 71; Central photography series of the Toronto Transit Commission,,OPEN - No restrictions on these government records.,Copyright is in the public domain and permission for use is not required...more,https://gencat4.eloquent-systems.com:443/webcat/systems/toronto.arch/resource/ser71/s0071_it7021.jpg,41446,25217,,,,,"1 photoprint : b&w; ; 13 x 18 cm
1 photonegative : glass, b&w; ; 13 x 18 cm",,,,,The item is a photograph looking at the burning of S.S. John Hanlan at Sunnyside beach as a public spectacle to mark its retirement from service.,,,,Alfred Pearson,,,,Locatable,yes,1929,,,"{""latLng"":""43.636766,-79.45201759999998""}"
Christie Gardens on Lambertlodge looking east to Melita,"Fonds 200, Series 1465, File 650, Item 7",1991,Photographs,File 650; Miscellaneous buildings,,OPEN - No restrictions on these government records.,Copyright was transferred to the City of Toronto by the copyright owner. ...more,https://gencat4.eloquent-systems.com:443/webcat/systems/toronto.arch/resource/ser1465/s1465_fl0650_it0007.jpg,574092,324319,1991,"1 photoprint : b&w; ; 25.5 cm x 20.5 cm
43 photoprints : colour ; 25.5 cm x 20.5 cm or smaller
78 transparencies : colour ; 35mm",Miscellaneous buildings,"File consists of images of various buildings, mostly on the waterfront and in the east end, including the Gooderham and Worts complex, Crombie Park, St. James Park, Cherry Beach, and other locations. Some are unidentified.",,,,,,,,,,,,,,Locatable,yes,1991,,,"{""latLng"":""43.6731898,-79.4226931""}"
Confederation Life Building,"Fonds 124, File 3, Item 99","December, 1982",Photographs - buildings - exterior views,"File 3; Buildings, Part 3",,OPEN - No restrictions on these non-government records.,Copyright was transferred to the City of Toronto by the copyright owner. ...more,https://gencat4.eloquent-systems.com:443/webcat/systems/toronto.arch/resource/fo0124/f0124_fl0003_id0099.jpg,429437,127338,1972-1991,200 transparencies : col. ; 35 mm,"Buildings, Part 3","File consists of colour slides documenting major streets, storefronts, and prominent buildings in central Toronto, including City Hall (1899-1965), City Hall (1965- ), Nathan Phillips Square, Don Jail, Terminal Warehouse, Eaton's College Street, Eaton's Annex, Birk's (Yonge Street), Downtown Theatre, Imperial Theatre, University Theatre, Royal Ontario Museum, the Yorkville Fire Hall, St. Paul's Cathedral (exterior and interior), Church of the Redeemer, St. Basil's Cathedral, St. James Cathedral, Little Trinity Church, the Consumer's Gas building on Berkely Street, Royal York Hotel, Lord Simcoe Hotel, Confederation Life Building, the Domestic Science Building at Queen's Park and Bloor, Casa Loma, the Sunnyside Bathing Pavillion, the Cyclotron (Front Street), SkyDome, the Monarch Flour Mills, and the Dominion Coal Silos. The streetscapes show corners, buildings and storefronts along downtown streets including Yonge Street, Adelaide Street, Front Street and Wellington Street.","1 transparency : col. slide, diapositive (Kodachrome) ; 35 mm",,,Ellis Wiley slide number: L2.81-16702.,,,,,,,,,,Locatable,yes,1982,,,"{""latLng"":""43.6519933,-79.37825079999999""}"
Entrance to parking garage for Harbour Square condominiums at foot of Bay Street,"Fonds 200, Series 1465, File 513, Item 31",[between 1982  and 1994],Photographs,File 513; Streets - Bay Street,,OPEN - No restrictions on these government records.,Copyright is held by the City of Toronto....more,https://gencat4.eloquent-systems.com:443/webcat/systems/toronto.arch/resource/ser1465/s1465_fl0513_it0031.jpg,552838,322665,[between 1982  and 1994],"35 transparencies : col ; 35mm
2 transparencies : b&w; ; 35mm",Streets - Bay Street,"File consists of images of Bay between the lakeshore and Bloor. File also includes a few images of York, Yonge, and University.",,,,,,,,,,,,,,Locatable,yes,1982,1994,,"{""latLng"":""43.6406593,-79.3764974""}"
"Upper Canada College, Lieut. Col. W. A. McCrimmon, inspecting cadets","Fonds 1266, Item 2669","May 20, 1924",Photographs,Fonds 1266; Globe and Mail fonds,,"OPEN - No restrictions on these non-government records.To preserve the original negatives, researchers should consult the microfiche reference copies, available in the Research Hall.","Copyright is in the public domain and permission for use is not required...moreThe following citation must be used when exhibiting or publishing this image: City of Toronto Archives, Globe and Mail fonds, Fonds 1266, Item 2669.",https://gencat4.eloquent-systems.com:443/webcat/systems/toronto.arch/resource/fo1266/f1266_it2669.jpg,281258,46341,,,,,"1 photonegative : b&w;, safety film ; 10 x 13 cm",,"Negative was reformatted from nitrate film to safety film, between 1987 and 1990.",Previously cited: City of Toronto Archives SC 266-2669.,"This photograph is available on microfiche, in the Research Hall at the City of Toronto Archives.",,,,,,,,,Locatable,yes,1924,,,"{""latLng"":""43.6914604,-79.40343769999998""}"
"Balmy Beach Canoe Club, Kathleen McKee, full figure","Fonds 1266, Item 5605","June 14, 1925",Photographs,Fonds 1266; Globe and Mail fonds,,"OPEN - No restrictions on these non-government records.To preserve the original negatives, researchers should consult the microfiche reference copies, available in the Research Hall.","Copyright is in the public domain and permission for use is not required...moreThe following citation must be used when exhibiting or publishing this image: City of Toronto Archives, Globe and Mail fonds, Fonds 1266, Item 5605.",https://gencat4.eloquent-systems.com:443/webcat/systems/toronto.arch/resource/fo1266/f1266_it5605.jpg,282287,46341,,,,,"1 photonegative : b&w;, glass ; 9 x 11 cm",,,Previously cited: City of Toronto Archives SC 266-5605.,"This photograph is available on microfiche, in the Research Hall at the City of Toronto Archives.",,,,,,,,,Locatable,yes,1925,,,"{""latLng"":""43.6699677,-79.28643110000002""}"
Three Discs by Menashe Kadishman,"Fonds 1598, File 5, Item 32",,,File 5; Three Discs by Menashe Kadishman,,OPEN - No restrictions on these non-government records.,Copyright was transferred to the City of Toronto by the copyright owner. ...more,https://gencat4.eloquent-systems.com:443/webcat/systems/toronto.arch/resource/fo1598/f1598_fl0005_id0032.jpg,438764,333467,1967,51 transparencies : col. ; 35mm,Three Discs by Menashe Kadishman,"File consists of 51 slides of the Israeli artist Menashe Kadishman, mostly portraits of him and his family.  There are also slides of the completed, painted steel sculpture and its installation in High Park.",,,,,,,,,,,,,,Locatable,yes,1967,,"It's on ""Sculpture Hill""; not sure exactly where that is.","{""latLng"":""43.64654789999999,-79.4636903""}"
"Corner of Sherbourne St. and Queens Quay, looking north-east","Fonds 2032, Series 841, File 71, Item 7",1972,Photographs,"File 71; Sherbourne Street corners, from the Gardiner Expressway to Queens Quay",,OPEN - No restrictions on these government records.,Copyright is held by the City of Toronto....more,https://gencat4.eloquent-systems.com:443/webcat/systems/toronto.arch/resource/ser841/s0841_fl0071_it0007.jpg,622066,622054,1972,"11 negatives : b&w; : 35 mm
3 photographs : b&w; ; 20 x 25 cm","Sherbourne Street corners, from the Gardiner Expressway to Queens Quay",,"1 negative : b&w; ; 35mm
1 print : b&w; ; 20 x 25 cm",STREETSCAPE (browse  records),,Previously cited as: RG32B neg 72-33 print 1214,,Item consists of one photograph of the Chas Abel Colour Plant.,,,,Jean-François Després,,,,Locatable,yes,1972,,,"{""latLng"":""43.6451803,-79.36542629999997""}"
Sterling Road,"Fonds 200, Series 372, Subseries 58, Item 371","December 1, 1913","Photographs - streetscapes
Photographs",Subseries 58; Road and street condition photographs,,OPEN - No restrictions on these government records.,Copyright is in the public domain and permission for use is not required...more,https://gencat4.eloquent-systems.com:443/webcat/systems/toronto.arch/resource/ser372/ss0058/s0372_ss0058_it0371.jpg,96459,84005,1910-1957,"2,502 photographs : b&w; ; 13 x 18 cm and smaller",Road and street condition photographs,"Subseries consists of photographs of streets and intersections across Toronto. Arranged chronologically, the photographs document road construction and maintenance projects including street paving (bitulithic, tarvia, concrete, Rocmac), road widening, track laying and reconstruction, and the creation of traffic islands. Also included are examples of damage to streets, including erosion, and weather-related incidents such as defective paving, cave-ins, curb heaving and flooding. ",1 photonegative : b&w; ; 15 x 18 cm,ROADS (browse  records),,,,,,,,,,,,Maybe,yes,1913,,,"{""latLng"":""43.6541401,-79.4447318""}"
Parks,"Fonds 124, File 10, Item 41",,,File 10; Parks,,OPEN - No restrictions on these non-government records.,Copyright was transferred to the City of Toronto by the copyright owner. ...more,https://gencat4.eloquent-systems.com:443/webcat/systems/toronto.arch/resource/fo0124/f0124_fl0010_id0041.jpg,430258,127345,1946-1983,42 transparencies : col. ; 35 mm,Parks,"File consists of colour slides documenting Toronto parks including High park, Riverdale Park, Toronto Island, Trethewey Park, James Gardens, Creek Park, Boyd Park, and Don Valley Park.",,,,,,,,,,,,,,Maybe,yes,1946,1983,Someone from Toronto might be able to figure out where this was taken.,
"Hairdressing Show, Bertha Jones, Sunnyside, Audrey Wilson, Petite","Fonds 1266, Item 15790","February 26, 1929",Photographs,Fonds 1266; Globe and Mail fonds,,"OPEN - No restrictions on these non-government records.To preserve the original negatives, researchers should consult the microfiche reference copies, available in the Research Hall.","Copyright is in the public domain and permission for use is not required...moreThe following citation must be used when exhibiting or publishing this image: City of Toronto Archives, Globe and Mail fonds, Fonds 1266, Item 15790.",https://gencat4.eloquent-systems.com:443/webcat/systems/toronto.arch/resource/fo1266/f1266_it15790.jpg,293092,46341,,,,,"1 photonegative : b&w;, safety film ; 10 x 13 cm",,"Negative was reformatted from nitrate film to safety film, between 1987 and 1990.",Previously cited: City of Toronto Archives SC 266-15790.,"This photograph is available on microfiche, in the Research Hall at the City of Toronto Archives.",,,,,,,,,Not Locatable,yes,1929,,,
Canadian National Exhibition,"Fonds 16, Series 71, Item 11537",1936,"Photographs
Photographs - events",Series 71; Central photography series of the Toronto Transit Commission,,"OPEN - No restrictions on these government records.Researchers may not have access to original prints or negatives, but may use the reference photocopies available in the Research Hall.",Copyright is in the public domain and permission for use is not required...more,https://gencat4.eloquent-systems.com:443/webcat/systems/toronto.arch/resource/ser71/s0071_it11537.jpg,58912,25217,,,,,"1 photoprint : b&w; ; 13 x 18 cm
1 photonegative : glass, b&w; ; 13 x 18 cm",PEOPLE (browse  records) BUILDINGS (browse  records),,,"A reference photocopy of this image is available on the photograph collection shelves of the Research Hall. See TTC Collection, Series 71, Wickson Worksheets.",,,,,Alfred Pearson,"City of Toronto Archives, Series 71, Item 11537",,,Locatable,yes,1936,,,"{""latLng"":""43.632629103458044,-79.423691539978""}"
Trailers - Gerrard and Center Avenues,"Fonds 200, Series 372, Subseries 33, Item 797","Sept. 12, 1941",,Subseries 33; Housing photographs,,OPEN - No restrictions on these government records.,Copyright is in the public domain and permission for use is not required...more,https://gencat4.eloquent-systems.com:443/webcat/systems/toronto.arch/resource//ser372/ss0033/s0372_ss0033_it0797.jpg,248046,83978,1936-1951,986 photographs : b&w; ; 13 x 18 cm and smaller,Housing photographs,Subseries consists of photographs of houses located across the former City of Toronto.,1 photonegative : b&w; ; 13 x 18 cm.  - 1 photoprint : b&w; ; 13 x 18 cm,,,,,,,,,,,,,Locatable,yes,1941,,,"{""latLng"":""43.653226,-79.38318429999998""}"
"Yonge Street, looking south from the McBrien Building","Fonds 1567, Series 648, File 248, Item 2",,,"File 248; Yonge Street, looking south from the McBrien Building",,OPEN - No restrictions on these non-government records.,Copyright was transferred to the City of Toronto by the copyright owner. ...more,https://gencat4.eloquent-systems.com:443/webcat/systems/toronto.arch/resource/fo1567/ser648/s0648_fl0248_id0002.jpg,448436,126977,1968,2 photonegatives : b&w; ; 7 x 10 cm or smaller,"Yonge Street, looking south from the McBrien Building","File consists of copy negatives of a picture of Yonge Street, looking south from the McBrien Building, and of an unidentified view of construction.",,,,,,,,,,,,,,Locatable,yes,1968,,,"{""latLng"":""43.697754,-79.39697949999999""}"
"C.N.E., Aircraft Bldg, from side","Fonds 1266, Item 14686","September 3, 1928",Photographs,Fonds 1266; Globe and Mail fonds,,"OPEN - No restrictions on these non-government records.To preserve the original negatives, researchers should consult the microfiche reference copies, available in the Research Hall.","Copyright is in the public domain and permission for use is not required...moreThe following citation must be used when exhibiting or publishing this image: City of Toronto Archives, Globe and Mail fonds, Fonds 1266, Item 14686.",https://gencat4.eloquent-systems.com:443/webcat/systems/toronto.arch/resource/fo1266/f1266_it14686.jpg,290619,46341,,,,,"1 photonegative : b&w;, glass ; 9 x 11 cm",,,Previously cited: City of Toronto Archives SC 266-14686.,"This photograph is available on microfiche, in the Research Hall at the City of Toronto Archives.",,,,,,,,,Locatable,yes,1928,,"canadian national exhibition has a permanent location down near the water, unclear what building this specifically is, could now be under BMO field","{""latLng"":""43.632877592749246,-79.42098787329098""}"
Bloor and Parliament looking south-west to city centre,"Fonds 200, Series 1465, File 766, Item 14",[1990 or 1991],Photographs,File 766; Architecture in the year 2000 slide show,,OPEN - No restrictions on these government records.,Copyright was transferred to the City of Toronto by the copyright owner. ...more,https://gencat4.eloquent-systems.com:443/webcat/systems/toronto.arch/resource/ser1465/s1465_fl0766_it0014.jpg,601300,325799,[191?]-1991; predmoinant 1970-1991,"29 transparencies : colour ; 35mm
8 transparencies : b&w; ; 35mm",Architecture in the year 2000 slide show,"File consists of slides used in a presentation given in October 1991 entitled ""Architecture in the year 2000, the role of urban design"".
Slides depict historical ward maps, aerials and presentation drawings.",,,,,,,,,,,,,,Locatable,yes,1990,1991,"""Architecture in the year 2000"" — sounds like something worth checking out!","{""latLng"":""43.6720333,-79.37072799999999""}"
"Memorial Hall, (interior), Niagara Historical Society, (Commercial)","Fonds 16, Series 71, Item 5346",July 1927,,Series 71; Central photography series of the Toronto Transit Commission,,OPEN - No restrictions on these government records.,Copyright is in the public domain and permission for use is not required...more,https://gencat4.eloquent-systems.com:443/webcat/systems/toronto.arch/resource/ser71/s0071_it5346.jpg,40203,25217,,,,,"1 photoprint : b&w; ; 13 x 18 cm
1 photonegative : glass, b&w; ; 13 x 18 cm",,,,,"The item is a photograph looking at a view of Niagara historical society, memorial hall erected in 1906 on the north side of Castlereagh Street, east of King Street, Niagara-on-the-Lake.",,,,Alfred Pearson,,,,Locatable,yes,1927,,,"{""latLng"":""43.252101194443355,-79.0717591718277""}"
